public/agilex_piper/urdf.json

[
  {
    "$": {
      "name": "fixed_base_joint",
      "type": "fixed"
    },
    "parent": {
      "$": {
        "link": "world"
      }
    },
    "child": {
      "$": {
        "link": "base_link"
      }
    }
  },
  {
    "$": {
      "name": "joint1",
      "type": "revolute"
    },
    "origin": {
      "$": {
        "rpy": [
          0,
          0,
          0
        ],
        "xyz": [
          0,
          0,
          0.123
        ]
      }
    },
    "parent": {
      "$": {
        "link": "base_link"
      }
    },
    "child": {
      "$": {
        "link": "link1"
      }
    },
    "axis": {
      "$": {
        "xyz": [
          0,
          0,
          1
        ]
      }
    },
    "limit": {
      "$": {
        "effort": 100,
        "lower": -2.618,
        "upper": 2.168,
        "velocity": 5
      }
    }
  },
  {
    "$": {
      "name": "joint2",
      "type": "revolute"
    },
    "origin": {
      "$": {
        "rpy": [
          1.5708,
          -0.10095,
          -3.1416
        ],
        "xyz": [
          0,
          0,
          0
        ]
      }
    },
    "parent": {
      "$": {
        "link": "link1"
      }
    },
    "child": {
      "$": {
        "link": "link2"
      }
    },
    "axis": {
      "$": {
        "xyz": [
          0,
          0,
          1
        ]
      }
    },
    "limit": {
      "$": {
        "effort": 100,
        "lower": 0,
        "upper": 3.14,
        "velocity": 5
      }
    }
  },
  {
    "$": {
      "name": "joint3",
      "type": "revolute"
    },
    "origin": {
      "$": {
        "rpy": [
          0,
          0,
          -1.759
        ],
        "xyz": [
          0.28503,
          0,
          0
        ]
      }
    },
    "parent": {
      "$": {
        "link": "link2"
      }
    },
    "child": {
      "$": {
        "link": "link3"
      }
    },
    "axis": {
      "$": {
        "xyz": [
          0,
          0,
          1
        ]
      }
    },
    "limit": {
      "$": {
        "effort": 100,
        "lower": -2.967,
        "upper": 0,
        "velocity": 5
      }
    }
  },
  {
    "$": {
      "name": "joint4",
      "type": "revolute"
    },
    "origin": {
      "$": {
        "rpy": [
          1.5708,
          0,
          0
        ],
        "xyz": [
          -0.021984,
          -0.25075,
          0
        ]
      }
    },
    "parent": {
      "$": {
        "link": "link3"
      }
    },
    "child": {
      "$": {
        "link": "link4"
      }
    },
    "axis": {
      "$": {
        "xyz": [
          0,
          0,
          1
        ]
      }
    },
    "limit": {
      "$": {
        "effort": 100,
        "lower": -1.745,
        "upper": 1.745,
        "velocity": 5
      }
    }
  },
  {
    "$": {
      "name": "joint5",
      "type": "revolute"
    },
    "origin": {
      "$": {
        "rpy": [
          -1.5708,
          0,
          0
        ],
        "xyz": [
          0,
          0,
          0
        ]
      }
    },
    "parent": {
      "$": {
        "link": "link4"
      }
    },
    "child": {
      "$": {
        "link": "link5"
      }
    },
    "axis": {
      "$": {
        "xyz": [
          0,
          0,
          1
        ]
      }
    },
    "limit": {
      "$": {
        "effort": 100,
        "lower": -1.22,
        "upper": 1.22,
        "velocity": 5
      }
    }
  },
  {
    "$": {
      "name": "joint6",
      "type": "revolute"
    },
    "origin": {
      "$": {
	"_comment": "手で修正。Agile-Xのxacroでは、原点位置がwith gripperでもno gripperでもLink6のフランジ面だが、mr.IKinBodyでは 0.1358m 加えたグリッパーの先端になっている。",
        "rpy": [
          1.5708,
          0,
          0
        ],
        "xyz": [
          0,
          -0.2268,
          0
        ]
      }
    },
    "parent": {
      "$": {
        "link": "link5"
      }
    },
    "child": {
      "$": {
        "link": "link6"
      }
    },
    "axis": {
      "$": {
        "xyz": [
          0,
          0,
          1
        ]
      }
    },
    "limit": {
      "$": {
        "effort": 100,
        "lower": -2.0944,
        "upper": 2.0944,
        "velocity": 5
      }
    }
  }
]

MEMO.md

## Agile-X提供のpiperのURDF

name   ,  type     , xyz                    ,rpy
"joint1", "revolute", "0 0 0.123",            "0 0 0"
"joint2", "revolute", "0 0 0",                "1.5708 -0.10095 -3.1416"
"joint3", "revolute", "0.28503 0 0",          "0 0 -1.759"
"joint4", "revolute", "-0.021984 -0.25075 0", "1.5708 0 0"
"joint5", "revolute", "0 0 0",                "-1.5708 0 0"
"joint6", "revolute", "0 -0.091 0",           "1.5708 0 0"

-0.10095radは、joint2がゼロの時link2の先をすこし持ち上げる
-1.759rad ≒ -100°は、join3がゼロの時完全に畳まれずlink4を10°持ち上げる
ArcTan[0.25075,0.021984]/Pi*180 ≒ 5.01048°